<?xml version="1.0" encoding="utf-8"?>

<vendeglatas xmlns:xsi="http://www.w3.org/2001/XMLSchema-instance" xsi:noNamespaceSchemaLocation="XBG3S6_XMLSchema.xsd">

<!-- Elemek -->
<etterem ekod="e1">
    <nev>..</nev>
    <cim>
        <varos>Budapest</varos>
        <utca>Visegrádi</utca>
        <hazszam>13</hazszam>
    </cim>
    <csillag>5</csillag>
</etterem>

<!-- Foszakacsok -->

<foszakacs fkod="f1" e_f="e1">
    <nev>Havas Péter</nev>
    <eletkor>35</eletkor>
    <vegzettseg>szakkozepiskola</vegzettseg>
    <vegzettseg>Intitut Paul Bocouese</vegzettseg> 
</foszakacs>

<foszakacs fkod="f2" e_f="e2">
    <nev>Nagy Károly</nev>
    <eletkor>30</eletkor>
    <vegzettseg>La Cordon Bleu</vegzettseg> 
</foszakacs>


<!-- Szakacsok -->

<szakacs szkod="sz1" e_sz="e1">
    <nev>Ötlet Elek</nev>
    <reszleg>Saucler</reszleg>
    <vegzettseg>Szakkozepiskola</vegzettseg>
    <vegzettseg>La Cordon Bleu</vegzettseg> 
    <vegzettseg>Intitut Paul Bocouese</vegzettseg> 
</szakacs>

<szakacs szkod="sz2" e_sz="e2">
    <nev>Kocsis Tibor</nev>
    <reszleg>Entremetier</reszleg>
    <vegzettseg>Szakkozepiskola</vegzettseg>
    <vegzettseg>La Cordon Bleu</vegzettseg> 
</szakacs>

<szakacs szkod="sz3" e_sz="e3">
    <nev>Tálas Levente</nev>
    <reszleg>Entremetier</reszleg>
    <vegzettseg>La Cordon Bleu</vegzettseg> 
     <vegzettseg>Intitut Paul Bocouese</vegzettseg> 
</szakacs>

<szakacs szkod="sz4" e_sz="e4">
    <nev>Valami Judit</nev>
    <reszleg>Entremetier</reszleg>
    <vegzettseg>La Cordon Bleu</vegzettseg> 
     <vegzettseg>Intitut Paul Bocouese</vegzettseg> 
</szakacs>

<!-- Gyakornok -->

<gyakornok gykod="1" e_gy="e1">
    <nev>Bordás Dávid</nev>
    <gyakorlat>
        <kezdete>2021.08.20</kezdete>
        <idotartam>2 honap</idotartam>
    </gyakorlat>
    <muszak>Délelőtt</muszak>
    <muszak>Este</muszak>
</gyakornok>

<gyakornok gykod="2" e_gy="e2">
    <nev>Szilágyi István</nev>
    <gyakorlat>
        <kezdete>2021.06.01</kezdete>
        <idotartam>4 honap</idotartam>
    </gyakorlat>
    <muszak>Délután</muszak>
</gyakornok>

<!-- Vendeg -->

<vendeg vkod="1" v="v1">
    <nev>Fekete Péter</nev>
    <eletkor>21</eletkor>
    <cim>
        <varos>Miskolc</varos>
        <utca>Márton</utca>
        <hazszam>17</hazszam>
    </cim>
</vendeg>

<vendeg vkod="2" v="v2">
    <nev>Bordás Áron</nev>
    <eletkor>25</eletkor>
    <cim>
        <varos>Miskolc</varos>
        <utca>Márton</utca>
        <hazszam>17</hazszam>
    </cim>
</vendeg>

<!-- Rendeles -->

<rendeles e_v_v="e1" e_v_v="v1">
    <osszeg>8000</osszeg>
    <etel>Kaviar</etel>
</rendeles>

<rendeles e_v_v="e2" e_v_v="v2">
    <osszeg>8000</osszeg>
    <etel>Steak</etel>
</rendeles>

<rendeles e_v_v="e3" e_v_v="v3">
    <osszeg>18000</osszeg>
    <etel>Zsiros kenyer</etel>
</rendeles>

<rendeles e_v_v="e4" e_v_v="v4">
    <osszeg>400</osszeg>
    <etel>Macko sajt</etel>
</rendeles>

</vendeglatas>






